{"$schema":"https://json-schema.org/draft/2020-12/schema","$id":"https://coh.invalid/contracts/kusto-validator/v1/policy-decision.schema.json","title":"COH Kusto validator policy decision","type":"object","additionalProperties":false,"required":["schema_version","contract_version","decision_id","query_id","outcome","reason_codes","actor_id","scope_digest","request_digest","response_digest","capability_digest","schema_digest","registry_digest","helper_attestation_digest","policy_decision_digest","audit_reservation_digest","observed_at","valid_until","digest"],"properties":{"schema_version":{"const":"coh.kusto-validator-decision/v1"},"contract_version":{"const":"1.0.0"},"decision_id":{"$ref":"#/$defs/uuid"},"query_id":{"$ref":"#/$defs/uuid"},"outcome":{"enum":["accepted","denied"]},"reason_codes":{"type":"array","maxItems":32,"uniqueItems":true,"items":{"$ref":"#/$defs/reason"}},"actor_id":{"$ref":"#/$defs/uuid"},"scope_digest":{"$ref":"#/$defs/digest"},"request_digest":{"$ref":"#/$defs/digest"},"response_digest":{"$ref":"#/$defs/digest"},"capability_digest":{"$ref":"#/$defs/digest"},"schema_digest":{"$ref":"#/$defs/digest"},"registry_digest":{"$ref":"#/$defs/digest"},"helper_attestation_digest":{"$ref":"#/$defs/digest"},"policy_decision_digest":{"$ref":"#/$defs/digest"},"audit_reservation_digest":{"$ref":"#/$defs/digest"},"observed_at":{"type":"string","format":"date-time"},"valid_until":{"type":"string","format":"date-time"},"digest":{"$ref":"#/$defs/digest"}},"$defs":{"uuid":{"type":"string","pattern":"^[0-9a-f]{8}-[0-9a-f]{4}-7[0-9a-f]{3}-[89ab][0-9a-f]{3}-[0-9a-f]{12}$"},"digest":{"type":"string","pattern":"^sha256:[0-9a-f]{64}$"},"reason":{"type":"string","pattern":"^[a-z][a-z0-9_]{0,63}$"}}}
