{"schema_version":"coh.kusto-validator-decision/v1","contract_version":"1.0.0","decision_id":"018f0000-0000-7000-8000-000000000003","query_id":"018f0000-0000-7000-8000-000000000004","outcome":"accepted","reason_codes":[],"actor_id":"018f0000-0000-7000-8000-000000000005","scope_digest":"sha256:7777777777777777777777777777777777777777777777777777777777777777","request_digest":"sha256:d3bfe87f5b80f6a67662fe52206eef346a260028f7cd311d8b4b3b5ec12f6bdd","response_digest":"sha256:f5fc4d0e98f019da7752e8cdd0e3cd86265e5f008231bb8a30396c9d177fa4d0","capability_digest":"sha256:3333333333333333333333333333333333333333333333333333333333333333","schema_digest":"sha256:4cb9761d4af4c21cef4d914377d6ba0c6649db07518f4c63a549d893d8c3fee3","registry_digest":"sha256:4b01ac2f77f54138c0a9b5fdab1a5a9195f147804aac44884e03860a83ee6f52","helper_attestation_digest":"sha256:6850e20ceab077a52ad5f734ab63908583c447305228167d58a068b6689cd7bb","policy_decision_digest":"sha256:8888888888888888888888888888888888888888888888888888888888888888","audit_reservation_digest":"sha256:9999999999999999999999999999999999999999999999999999999999999999","observed_at":"2026-08-28T02:00:30Z","valid_until":"2026-08-28T02:02:30Z","digest":"sha256:432cc05ce2638b1e5988ad9bb93b074e66007d66cdc5d9c6385a010563aec883"}
